article_url,source_name_raw,category_raw,author_raw,published_at_raw,title_raw,summary_raw,content_raw,tags_raw,scraped_at,run_id
https://vnexpress.net/chay-quan-lau-duoi-chan-cau-long-bien-4969239.html,VnExpress,Thời sự,Việt An,"Thứ năm, 20/11/2025, 14:13 (GMT+7)",Cháy quán lẩu dưới chân cầu Long Biên,"Hà NộiQuán lẩu trong chợ ẩm thực Ngọc Lâm bất ngờ bốc cháy trưa 20/11, khói lửa bùng cao kèm nhiều tiếng nổ, nghi do nổ bình gas.","Khoảng 12h, lửa bùng lên trong quán lẩu gạch tôm sông thuộc phường Bồ Đề. Quán đang sửa chữa, không có khách, những người làm việc bên trong kịp chạy ra ngoài.Video Player is loading.XemHiện tại0:00/Thời lượng0:12Đã tải: 0%0:00Tiến trình: 0%Tắt tiếngTỷ lệ phát lại1xChương mụcChương mụcDescriptionsdescriptions off, selectedAudio TrackToàn màn hìnhThis is a modal window.Beginning of dialog window. Escape will cancel and close the window.TextColorWhiteBlackRedGreenBlueYellowMagentaCyanTransparencyOpaqueSemi-TransparentBackgroundColorBlackWhiteRedGreenBlueYellowMagentaCyanTransparencyOpaqueSemi-TransparentTransparentWindowColorBlackWhiteRedGreenBlueYellowMagentaCyanTransparencyTransparentSemi-TransparentOpaqueFont Size50%75%100%125%150%175%200%300%400%Text Edge StyleNoneRaisedDepressedUniformDropshadowFont FamilyProportional Sans-SerifMonospace Sans-SerifProportional SerifMonospace SerifCasualScriptSmall CapsResetrestore all settings to the default valuesDoneClose Modal DialogEnd of dialog window.Cháy quán lẩu dưới chân cầu Long BiênQuán lẩu bốc cháy. Video:Anh MinhNhân chứng cho biết lửa bén từ lúc thợ hàn xì, cháy lan vào lớp xốp, tạo khói dày và mùi khét. Quá trình cháy xuất hiện nhiều tiếng nổ nghi do nổ bình gas mini và bình gas lớn, buộc người dân xung quanh phải di dời.Trước khi lực lượng chức năng tới, nhiều người dùng bình cứu hỏa và nước để dập lửa. Cảnh sát Phòng cháy chữa cháy sau đó điều ít nhất 4 xe chữa cháy và một xe chở nước tới ứng cứu. Đến khoảng 13h, đám cháy được khống chế.Quán rộng hơn 100 m2, vừa được sang nhượng, gồm sân và nhiều phòng khép kín. Nhiều đồ đạc và phần mái che bị thiêu rụi sau vụ cháy.Khói bốc lên từ đám cháy tại quán lẩu. Ảnh:Anh MinhViệt AnCháy ôtô đỗ trong chung cư ở TP HCMÔtô 5 chỗ đỗ trong chung cư ở phường An Khánh (TP Thủ Đức cũ) bất ngờ bốc cháy kèm tiếng nổ lớn, lan sang xe 7 chỗ, trưa 16/11.68Hàng trăm người tháo chạy vì cháy căn hộ chung cư ở TP HCMNgọn lửa bùng lên tại căn hộ tầng 12 chung cư Dream Home Palace trên đường Trịnh Quang Nghị, quận 8 cũ, khiến hàng trăm người chạy thang bộ xuống đất, chiều 15/11.17","Hà Nội, Cháy nhà, chợ ẩm thực Ngọc Lâm",2025-11-20 15:42:05.644138,82772378-87de-4fb3-be25-75270c195bb0
https://vnexpress.net/san-bay-duong-sat-quoc-lo-qua-mien-trung-te-liet-4969229.html,VnExpress,Thời sự,Nhóm phóng viên,"Thứ năm, 20/11/2025, 15:00 (GMT+7)","Sân bay, đường sắt, quốc lộ qua miền Trung tê liệt","Mưa lớn lịch sử kèm sạt lở khiến hàng loạt tuyến đường qua Khánh Hòa, Đăk Lăk, Gia Lai… bị chia cắt; sân bay Tuy Hòa phải đóng cửa, đường sắt Bắc Nam dừng nhiều đoàn tàu.","Sáng 20/11, sau 25 tiếng bị mắc kẹt tại khu vực Chí Thạnh (thuộc Phú Yên cũ) do ngập lụt, hai ôtô khách của nhà xe Cuộc Huê từ khu vực TP HCM về Bình Định (cũ) mới tiếp tục hành trình sau khi nước rút.Giao thông qua xã Đông Hòa, tỉnh Đăk Lăk (xã Hòa Vinh, tỉnh Phú Yên cũ) tê liệt do lũ, sáng 20/11. Ảnh:Trần HóaHôm qua, xe chạy trên quốc lộ 1, đến đoạn qua Chí Thạnh, nước ngập gần một mét khiến giao thông tê liệt. Gần 50 hành khách trên hai ôtô bị kẹt lại, được nhà xe hỗ trợ mì gói và các thực phẩm khác trong lúc chờ đợi. Hàng chục xe khách, ôtô tải đến khu vực này cũng phải quay đầu hoặc xếp hàng dài dừng chờ.""Chạy xe khách nhiều năm nhưng chưa bao giờ chúng tôi thấy ngập nặng như vậy. May mắn, các chuyến xe đã chở khách về đến nơi an toàn"", nhân viên nhà xe Cuộc Huê nói.Sau các đợt mưa lớn kéo dài, từ sáng 19/11 quốc lộ 1 qua Khánh Hòa, Đăk Lăk, Gia Lai... xuất hiện nhiều điểm ách tắc do nước lũ kèm đất đá tràn xuống đường. Một số vị trí giao thông bị gián đoạn hoàn toàn, xe máy, ôtô gầm thấp buộc phải quay đầu.Ông Đỗ Xuân Định (48 tuổi, Hải Phòng), tài xế container chạy hướng Nam - Bắc, cho biết khi đến xã Đông Hòa (Phú Yên cũ) thì thấy nước lũ đổ về. Nghĩ tổng trọng tải xe 30 tấn có thể vượt qua, ông thử đánh lái nhưng chỉ đi được khoảng 30 m thì xe chao đảo. ""Nước cuồn cuộn, xe tôi chòng chành nên đành tấp vào lề để tránh nguy hiểm"", ông kể.Tài xế Đỗ Xuân Định ăn bánh mì, chờ đợi nước rút, sáng 20/11. Ảnh:Trần HóaKinh nghiệm lái xe gần 20 năm, ông Định sau đó tiếp tục cho ôtô quay đầu, tìm vị trí cao hơn để tránh trú khi thấy nước tiếp tục đổ về, gây ngập dài hơn một km. Đêm qua, ông ngủ lại trong cabin nhưng phải nhịn đói vì lương thực mang theo đã hết, xung quanh không có hàng quán.""Sáng nay nhờ đoàn từ thiện đi qua hỗ trợ bánh, mì tôm, nước... giúp tôi cầm cự. May mắn hàng trên xe là nông sản sấy khô, không phải đông lạnh dễ hư hỏng"", ông nói.Quảng cáoNgoài quốc lộ 1, nhiều tuyến giao thông quan trọng đi Nha Trang, Đà Lạt, Quy Nhơn..., cũng đang ùn tắc do mưa lũ. Vụ sạt lở nghiêm trọng ởđèo Khánh Lêqua Khánh Hòa hôm 16/11 khiến tuyến huyết mạch nối Lâm Đồng - Khánh Hòa tê liệt bốn hôm nay. Đường đèo nằm trên quốc lộ 27C, giúp rút ngắn quãng đường từ Đà Lạt đi Nha Trang còn khoảng 140 km, thay vì hơn 220 km nếu theo đèo Ngoạn Mục (Ninh Thuận cũ).Sau sự cố, đèo Khánh Lê vẫn đang được khắc phục, chưa thể thông tuyến trở lại. Xe từ Lâm Đồng về miền Trung đang phải chuyển qua lộ trình theo quốc lộ 20, vòng sang quốc lộ 27, vượt đèo Sông Pha xuống Phan Rang, khiến quãng đường xa hơn 100 km.Ôtô bị kẹt hàng chục km từ Phù Mỹ Bắc đến xã Phù Cát, tỉnh Gia Lai (BÌnh Định cũ), sáng 20/11. Ảnh:Phạm LinhTrong khi đó, hướng từ TP HCM lên Đà Lạt, giao thông cũng bị gián đoạn. Đêm 19/11,đèo MimosaMimosa trên quốc lộ 20 bị sạt lở, đứt gãy toàn bộ nền, mặt đường với chiều dài 70 m, sâu 40 m. Một đoạn khác cũng bị sạt taluy âm nền đường dài 36 m, sâu 6 m, đường bị lún sâu 30 cm, nguy cơ mở rộng.Tỉnh Lâm Đồng đã phải công bố tình huống khẩn cấp về thiên tai ở đèo Mimosa và quốc lộ 20, cấm xe qua các khu vực nguy cơ sạt lở để đảm bảo an toàn.Trước đó, đèo Prenn lên Đà Lạt cũng bị sạt lở và cấm xe từ hôm 17/11. Sau khi sự cố tương tự xảy ra ở đèo Mimosa, hiện các tuyến chính dẫn đến trung tâm du lịch này chỉ còn đèo Sacom Tuyền Lâm và đèo Tà Nung. Tuy vậy, các tuyến này xa hơn, nhất là hướng từ TP HCM lên Đà Lạt, ảnh hưởng lớn nhu cầu đi lại.Cục Đường bộ Việt Nam đang yêu cầu các Khu quản lý đường bộ và nhà đầu tư BOT trên các tuyến đường tăng cường máy móc, vật tư xử lý điểm sạt lở; bố trí lực lượng cảnh giới, phân luồng 24/24 để giảm thiểu rủi ro.Đèo Mimosa sạt lở nghiêm trọng khiến giao thông qua tuyến này tê liệt, sáng 20/11. Ảnh:Trường HàCùng với đường bộ, đường sắt Bắc Nam đoạn qua Nam Trung Bộ cũng đang tê liệt nhiều đoạn do ngập và xói lở nền đường. Ngày 20/11, Tổng công ty Đường sắt phải dừng tàu SE5, SE7, SE21; từ ga Sài Gòn tạm ngừng SE4, SE2, SE8, SE6, SE22. Trước đó một ngày, ngành đường sắt đã dừng bốn tàu chở khoảng 1.200 hành khách. Tính từ 17/11, đã có hơn chục đoàn tàu bị ngừng chạy.Ảnh hưởng mưa lũ, Cục Hàng không cũng đã yêu cầu tạm ngừng hoạt động sân bay Tuy Hòa (Đăk Lăk, Phú Yên cũ) từ 10h đến 24h ngày 20/11 do nhiều hạng mục bị ngập, hệ thống điện mất hoàn toàn.Theo cơ quan quản lý, nước lũ dâng khiến một phần đường băng bị ngập sâu, nhiều thiết bị kỹ thuật phải ngừng vận hành và các tuyến đường vào sân bay bị chia cắt. Lực lượng chức năng tại sân bay này đang khẩn trương gia cố trang thiết bị để bảo đảm an toàn và hạn chế ảnh hưởng tới hoạt động khai thác bay.Sân bay Tuy Hòa ngưng hoạt động khiến nhiều chuyến bay phải tạm dừng. Vietnam Airlines thông báo hủy bốn chuyến bay giữa Hà Nội, TP HCM và Tuy Hòa (VN1650, VN1651, VN1660, VN1661). Hãng tiếp tục cập nhật và điều phối theo tình hình thực tế nhằm đảm bảo an toàn.Chuyến bay từ Tân Sơn Nhất đi Tuy Hòa sáng nay delay 2 tiếng và sau đó hủy chuyến. Hàng trăm hành khách tìm cách đổi trả vé tại quầy thủ tục. Ảnh:Thanh TùngTheo Cục Quản lý đê điều và Phòng chống thiên tai, trong bốn ngày 16-20/11, nhiều tỉnh miền Trung - Tây Nguyên ghi nhận lượng mưa 600-1.700 mm.Lũ trên sông Ba (Đăk Lăk) vượt đỉnh năm 1993 hơn một mét; sông Dinh (Ninh Hòa - Khánh Hòa) vượt mức lũ 1986.Toàn vùng đã di dời hơn 17.600 hộ dân; 43.282 nhà bị ngập; nhiều tuyến quốc lộ bị sạt lở. Thiệt hại ban đầu gồm 21 người chết và mất tích; hơn 10.000 ha hoa màu hư hại; 6.500 gia súc, gia cầm cuốn trôi; 650 m kè và một số hồ chứa bị hỏng; hơn nửa triệu khách hàng mất điện.Chính phủ đã liên tiếp ban hành công điện chỉ đạo ứng phó, đồng thời hỗ trợ khẩn cấp 50 tỷ đồng cho Khánh Hòa khắc phục hậu quả.Nhóm phóng viênQuỹ Hy vọng - báo VnExpress mở chiến dịch ""Cùng đồng bào vượt lũ"" nhằm hỗ trợ người dân vượt lên nghịch cảnh thiên tai, tái thiết các trường học bị thiệt hại. Quý độc giả ủng hộtại đây.Hiện trạng đèo Mimosa bị xé toạc, chia cắt giao thôngĐèo Mimosa cửa ngõ Đà Lạt bị xé toạc đoạn hơn 50 m, kéo đất đá, cây cối tràn xuống bên dưới và khiến một ôtô khách suýt bị cuốn xuống vực.21Sạt lở núi đè ôtô khách ở Khánh Hòa, 6 người chếtĐèo Khánh Lê ở quốc lộ 27C sạt lở sau mưa, đất đá vùi lấp xe khách từ Đà Lạt xuống Nha Trang, 6 người tử vong, 19 nạn nhân bị thương, thi thể cuối cùng tìm thấy trưa nay.143","giao thông tê liệt, Sạt lở, Lũ lụt miền Trung",2025-11-20 15:42:10.656969,82772378-87de-4fb3-be25-75270c195bb0
https://vnexpress.net/san-bay-duong-sat-quoc-lo-qua-mien-trung-te-liet-4969229.html#box_comment_vne,VnExpress,Thời sự,Nhóm phóng viên,"Thứ năm, 20/11/2025, 15:00 (GMT+7)","Sân bay, đường sắt, quốc lộ qua miền Trung tê liệt","Mưa lớn lịch sử kèm sạt lở khiến hàng loạt tuyến đường qua Khánh Hòa, Đăk Lăk, Gia Lai… bị chia cắt; sân bay Tuy Hòa phải đóng cửa, đường sắt Bắc Nam dừng nhiều đoàn tàu.","Sáng 20/11, sau 25 tiếng bị mắc kẹt tại khu vực Chí Thạnh (thuộc Phú Yên cũ) do ngập lụt, hai ôtô khách của nhà xe Cuộc Huê từ khu vực TP HCM về Bình Định (cũ) mới tiếp tục hành trình sau khi nước rút.Giao thông qua xã Đông Hòa, tỉnh Đăk Lăk (xã Hòa Vinh, tỉnh Phú Yên cũ) tê liệt do lũ, sáng 20/11. Ảnh:Trần HóaHôm qua, xe chạy trên quốc lộ 1, đến đoạn qua Chí Thạnh, nước ngập gần một mét khiến giao thông tê liệt. Gần 50 hành khách trên hai ôtô bị kẹt lại, được nhà xe hỗ trợ mì gói và các thực phẩm khác trong lúc chờ đợi. Hàng chục xe khách, ôtô tải đến khu vực này cũng phải quay đầu hoặc xếp hàng dài dừng chờ.""Chạy xe khách nhiều năm nhưng chưa bao giờ chúng tôi thấy ngập nặng như vậy. May mắn, các chuyến xe đã chở khách về đến nơi an toàn"", nhân viên nhà xe Cuộc Huê nói.Sau các đợt mưa lớn kéo dài, từ sáng 19/11 quốc lộ 1 qua Khánh Hòa, Đăk Lăk, Gia Lai... xuất hiện nhiều điểm ách tắc do nước lũ kèm đất đá tràn xuống đường. Một số vị trí giao thông bị gián đoạn hoàn toàn, xe máy, ôtô gầm thấp buộc phải quay đầu.Ông Đỗ Xuân Định (48 tuổi, Hải Phòng), tài xế container chạy hướng Nam - Bắc, cho biết khi đến xã Đông Hòa (Phú Yên cũ) thì thấy nước lũ đổ về. Nghĩ tổng trọng tải xe 30 tấn có thể vượt qua, ông thử đánh lái nhưng chỉ đi được khoảng 30 m thì xe chao đảo. ""Nước cuồn cuộn, xe tôi chòng chành nên đành tấp vào lề để tránh nguy hiểm"", ông kể.Tài xế Đỗ Xuân Định ăn bánh mì, chờ đợi nước rút, sáng 20/11. Ảnh:Trần HóaKinh nghiệm lái xe gần 20 năm, ông Định sau đó tiếp tục cho ôtô quay đầu, tìm vị trí cao hơn để tránh trú khi thấy nước tiếp tục đổ về, gây ngập dài hơn một km. Đêm qua, ông ngủ lại trong cabin nhưng phải nhịn đói vì lương thực mang theo đã hết, xung quanh không có hàng quán.""Sáng nay nhờ đoàn từ thiện đi qua hỗ trợ bánh, mì tôm, nước... giúp tôi cầm cự. May mắn hàng trên xe là nông sản sấy khô, không phải đông lạnh dễ hư hỏng"", ông nói.Quảng cáoNgoài quốc lộ 1, nhiều tuyến giao thông quan trọng đi Nha Trang, Đà Lạt, Quy Nhơn..., cũng đang ùn tắc do mưa lũ. Vụ sạt lở nghiêm trọng ởđèo Khánh Lêqua Khánh Hòa hôm 16/11 khiến tuyến huyết mạch nối Lâm Đồng - Khánh Hòa tê liệt bốn hôm nay. Đường đèo nằm trên quốc lộ 27C, giúp rút ngắn quãng đường từ Đà Lạt đi Nha Trang còn khoảng 140 km, thay vì hơn 220 km nếu theo đèo Ngoạn Mục (Ninh Thuận cũ).Sau sự cố, đèo Khánh Lê vẫn đang được khắc phục, chưa thể thông tuyến trở lại. Xe từ Lâm Đồng về miền Trung đang phải chuyển qua lộ trình theo quốc lộ 20, vòng sang quốc lộ 27, vượt đèo Sông Pha xuống Phan Rang, khiến quãng đường xa hơn 100 km.Ôtô bị kẹt hàng chục km từ Phù Mỹ Bắc đến xã Phù Cát, tỉnh Gia Lai (BÌnh Định cũ), sáng 20/11. Ảnh:Phạm LinhTrong khi đó, hướng từ TP HCM lên Đà Lạt, giao thông cũng bị gián đoạn. Đêm 19/11,đèo MimosaMimosa trên quốc lộ 20 bị sạt lở, đứt gãy toàn bộ nền, mặt đường với chiều dài 70 m, sâu 40 m. Một đoạn khác cũng bị sạt taluy âm nền đường dài 36 m, sâu 6 m, đường bị lún sâu 30 cm, nguy cơ mở rộng.Tỉnh Lâm Đồng đã phải công bố tình huống khẩn cấp về thiên tai ở đèo Mimosa và quốc lộ 20, cấm xe qua các khu vực nguy cơ sạt lở để đảm bảo an toàn.Trước đó, đèo Prenn lên Đà Lạt cũng bị sạt lở và cấm xe từ hôm 17/11. Sau khi sự cố tương tự xảy ra ở đèo Mimosa, hiện các tuyến chính dẫn đến trung tâm du lịch này chỉ còn đèo Sacom Tuyền Lâm và đèo Tà Nung. Tuy vậy, các tuyến này xa hơn, nhất là hướng từ TP HCM lên Đà Lạt, ảnh hưởng lớn nhu cầu đi lại.Cục Đường bộ Việt Nam đang yêu cầu các Khu quản lý đường bộ và nhà đầu tư BOT trên các tuyến đường tăng cường máy móc, vật tư xử lý điểm sạt lở; bố trí lực lượng cảnh giới, phân luồng 24/24 để giảm thiểu rủi ro.Đèo Mimosa sạt lở nghiêm trọng khiến giao thông qua tuyến này tê liệt, sáng 20/11. Ảnh:Trường HàCùng với đường bộ, đường sắt Bắc Nam đoạn qua Nam Trung Bộ cũng đang tê liệt nhiều đoạn do ngập và xói lở nền đường. Ngày 20/11, Tổng công ty Đường sắt phải dừng tàu SE5, SE7, SE21; từ ga Sài Gòn tạm ngừng SE4, SE2, SE8, SE6, SE22. Trước đó một ngày, ngành đường sắt đã dừng bốn tàu chở khoảng 1.200 hành khách. Tính từ 17/11, đã có hơn chục đoàn tàu bị ngừng chạy.Ảnh hưởng mưa lũ, Cục Hàng không cũng đã yêu cầu tạm ngừng hoạt động sân bay Tuy Hòa (Đăk Lăk, Phú Yên cũ) từ 10h đến 24h ngày 20/11 do nhiều hạng mục bị ngập, hệ thống điện mất hoàn toàn.Theo cơ quan quản lý, nước lũ dâng khiến một phần đường băng bị ngập sâu, nhiều thiết bị kỹ thuật phải ngừng vận hành và các tuyến đường vào sân bay bị chia cắt. Lực lượng chức năng tại sân bay này đang khẩn trương gia cố trang thiết bị để bảo đảm an toàn và hạn chế ảnh hưởng tới hoạt động khai thác bay.Sân bay Tuy Hòa ngưng hoạt động khiến nhiều chuyến bay phải tạm dừng. Vietnam Airlines thông báo hủy bốn chuyến bay giữa Hà Nội, TP HCM và Tuy Hòa (VN1650, VN1651, VN1660, VN1661). Hãng tiếp tục cập nhật và điều phối theo tình hình thực tế nhằm đảm bảo an toàn.Chuyến bay từ Tân Sơn Nhất đi Tuy Hòa sáng nay delay 2 tiếng và sau đó hủy chuyến. Hàng trăm hành khách tìm cách đổi trả vé tại quầy thủ tục. Ảnh:Thanh TùngTheo Cục Quản lý đê điều và Phòng chống thiên tai, trong bốn ngày 16-20/11, nhiều tỉnh miền Trung - Tây Nguyên ghi nhận lượng mưa 600-1.700 mm.Lũ trên sông Ba (Đăk Lăk) vượt đỉnh năm 1993 hơn một mét; sông Dinh (Ninh Hòa - Khánh Hòa) vượt mức lũ 1986.Toàn vùng đã di dời hơn 17.600 hộ dân; 43.282 nhà bị ngập; nhiều tuyến quốc lộ bị sạt lở. Thiệt hại ban đầu gồm 21 người chết và mất tích; hơn 10.000 ha hoa màu hư hại; 6.500 gia súc, gia cầm cuốn trôi; 650 m kè và một số hồ chứa bị hỏng; hơn nửa triệu khách hàng mất điện.Chính phủ đã liên tiếp ban hành công điện chỉ đạo ứng phó, đồng thời hỗ trợ khẩn cấp 50 tỷ đồng cho Khánh Hòa khắc phục hậu quả.Nhóm phóng viênQuỹ Hy vọng - báo VnExpress mở chiến dịch ""Cùng đồng bào vượt lũ"" nhằm hỗ trợ người dân vượt lên nghịch cảnh thiên tai, tái thiết các trường học bị thiệt hại. Quý độc giả ủng hộtại đây.Hiện trạng đèo Mimosa bị xé toạc, chia cắt giao thôngĐèo Mimosa cửa ngõ Đà Lạt bị xé toạc đoạn hơn 50 m, kéo đất đá, cây cối tràn xuống bên dưới và khiến một ôtô khách suýt bị cuốn xuống vực.21Sạt lở núi đè ôtô khách ở Khánh Hòa, 6 người chếtĐèo Khánh Lê ở quốc lộ 27C sạt lở sau mưa, đất đá vùi lấp xe khách từ Đà Lạt xuống Nha Trang, 6 người tử vong, 19 nạn nhân bị thương, thi thể cuối cùng tìm thấy trưa nay.143","giao thông tê liệt, Sạt lở, Lũ lụt miền Trung",2025-11-20 15:42:13.172473,82772378-87de-4fb3-be25-75270c195bb0
https://vnexpress.net/ha-noi-thi-diem-cam-oto-tren-10-tan-di-vao-ba-tuyen-duong-4969177.html,VnExpress,Thời sự,Việt An,"Thứ năm, 20/11/2025, 14:17 (GMT+7)",Hà Nội thí điểm cấm ôtô trên 10 tấn đi vào ba tuyến đường,"Sở Xây dựng Hà Nội sẽ thí điểm cấm ôtô tải trên 10 tấn lưu thông vào đường Phúc La, Phan Trọng Tuệ và Cầu Bươu trong giờ cao điểm, bắt đầu từ ngày 24/11.","Theo kế hoạch, thời gian thí điểm kéo dài đến ngày 25/2/2025. Trong giai đoạn này, xe tải trên 10 tấn bị cấm đi vào đường Phúc La (hướng từ nút giao Văn Khê đến nút giao Cầu Bươu - Phùng Hưng), đường Phan Trọng Tuệ và Cầu Bươu (đoạn từ đường Đại Thanh đến nút giao Phúc La - Phùng Hưng) vào các khung giờ cao điểm sáng và chiều.Các phương tiện thuộc diện cấm sẽ được hướng dẫn di chuyển theo lộ trình quốc lộ 1A - đường tỉnh 427 - trục phát triển phía Nam Hà Nội - đường vành đai 3,5 (nút Văn Khê) và ngược lại. Lực lượng chức năng đang bổ sung biển báo từ xa tại các nút giao để xe tải trên 10 tấn nhận biết và chuyển hướng sớm.Tuyến đường Phan Trọng Tuệ thường xuyên ùn tắc. Ảnh:Ngọc ThànhViệc tạm cấm được triển khai trong bối cảnh các tuyến đường trên thường xuyên ùn tắc nặng vào giờ cao điểm. Đường Phan Trọng Tuệ (quốc lộ 70) dài khoảng 4 km, rộng 40 m, là trục kết nối Hà Đông - Văn Điển, đi qua khu dân cư đông đúc, mật độ xe tải và container lớn. Tuyến đường không được mở rộng trong khi dân số tăng nhanh khiến tình trạng ùn tắc kéo dài hơn 10 năm.Các ""điểm đen"" khác gồm khu vực cầu Bươu và nút giao đường 70 với đường Phạm Tu (gần bệnh viện K Tân Triều), nơi lưu lượng phương tiện luôn vượt năng lực thông hành.Quảng cáoHà Nội từng chuẩn bị phương án xây dựng cầu vượt tại nút giao Phạm Tu - Phan Trọng Tuệ - Phúc La, tuy nhiên dự án nhiều năm chưa triển khai được do vướng giải phóng mặt bằng.Việt AnĐèo Vi Ô Lắc sạt lở, ôtô ùn tắc 2 kmĐèo Vi Ô Lắc trên quốc lộ 24 bị sạt lở taluy, đất đá đổ xuống đường khoảng 100 m3, khiến ôtô ùn ứ kéo dài, chiều 16/11.2TP HCM làm hai đường gom giảm ùn tắc khu vực cầu Kênh TẻĐường gom đầu cầu Kênh Tẻ được xây dựng nối tuyến Trần Xuân Soạn và Nguyễn Hữu Thọ giúp người dân thuận tiện đi lại trên trục huyết mạch cửa ngõ phía Nam.41","Sở Xây dựng, Cấm xe tải, xe tải trên 10 tấn",2025-11-20 15:42:18.245084,82772378-87de-4fb3-be25-75270c195bb0
